[
  { "id": "scholar-cross-reference", "name": "比對文獻",   "type": "thinking",      "cost": 1, "tags": ["analysis", "lore"],     "description": "調閱腦中記憶的典籍段落，以智識判定揭示線索深意。" },
  { "id": "scholar-arcane-lore",     "name": "古學知識",   "type": "thinking",      "cost": 1, "tags": ["lore", "analysis"],     "description": "對符文、古語、禁忌儀式進行智識判定。" },
  { "id": "scholar-careful-read",    "name": "仔細閱讀",   "type": "exploration",   "cost": 1, "tags": ["search", "perception"], "description": "在書房、筆記、日記堆中耐心翻找，獲得線索或裝備。" },
  { "id": "scholar-decipher",        "name": "破譯密語",   "type": "thinking",      "cost": 1, "tags": ["analysis"],              "description": "將雜亂字條與符號整理為能理解的訊息，思考判定。" },
  { "id": "scholar-note-taking",     "name": "整理筆記",   "type": "exploration",   "cost": 0, "tags": ["analysis", "search"],    "description": "將本次冒險收集到的片段畫成關係圖，追加 1 線索碎片。" },
  { "id": "scholar-polite-inquiry",  "name": "斯文問話",   "type": "communication", "cost": 1, "tags": ["persuade"],              "description": "以學者姿態向村民或同伴打探情報，溝通判定。" },
  { "id": "scholar-reassure",        "name": "安撫同伴",   "type": "communication", "cost": 1, "tags": ["support", "heal"],       "description": "引用一段理性分析，為慌亂中的同伴穩定心神。" },
  { "id": "scholar-warding-chant",   "name": "禳祓咒文",   "type": "combat",        "cost": 2, "tags": ["ward", "ritual"],        "description": "以學過的古文口訣驅散邪物，戰鬥判定以智識為基底。",
    "combat": { "route": "damageMultiplier", "damageMultiplier": 1.2, "rollBonus": 0, "tags": ["ritual"] } },
  { "id": "scholar-cold-observation","name": "冷眼旁觀",   "type": "thinking",      "cost": 0, "tags": ["analysis"],              "description": "在混亂中保持冷靜，下一次思考判定 +1。" },
  { "id": "scholar-improvised-kit",  "name": "應急配方",   "type": "thinking",      "cost": 2, "tags": ["heal", "support"],       "description": "以草藥與酒精混製簡易療傷劑，恢復 HP 或去除異常狀態。" },

  { "id": "guard-strike",            "name": "揮拳出擊",   "type": "combat",        "cost": 1, "tags": ["attack"],                "description": "憑體格直接衝擊對手，戰鬥判定。",
    "combat": { "route": "rollBonus", "damageMultiplier": 1.0, "rollBonus": 0, "tags": [] } },
  { "id": "guard-overhand-smash",    "name": "重擊砸下",   "type": "combat",        "cost": 2, "tags": ["attack"],                "description": "蓄力一擊，傷害較高但消耗行動點。",
    "combat": { "route": "damageMultiplier", "damageMultiplier": 1.5, "rollBonus": 0, "tags": [] } },
  { "id": "guard-shield-stance",     "name": "護身架勢",   "type": "combat",        "cost": 1, "tags": ["defend"],                "description": "擺出防禦姿態，本回合受到的傷害減 2。",
    "combat": { "route": "rollBonus", "damageMultiplier": 1.0, "rollBonus": 0, "tags": ["defend"] } },
  { "id": "guard-intimidate",        "name": "低聲恫嚇",   "type": "communication", "cost": 1, "tags": ["intimidate", "persuade"], "description": "以壓迫氣場逼對方退讓，溝通判定。" },
  { "id": "guard-break-down-door",   "name": "破門而入",   "type": "exploration",   "cost": 1, "tags": ["attack", "search"],      "description": "直接撞破任何障礙，以力量判定進入封閉區域。" },
  { "id": "guard-overwatch",         "name": "警戒環視",   "type": "combat",        "cost": 1, "tags": ["defend", "support"],     "description": "替同伴擋下第一波衝擊，同伴下次受擊傷害 -2。",
    "combat": { "route": "rollBonus", "damageMultiplier": 1.0, "rollBonus": 0, "tags": ["support"] } },
  { "id": "guard-rush",              "name": "長槍突刺",   "type": "combat",        "cost": 1, "tags": ["attack"],                "description": "以最短距離衝向敵方高威脅目標。",
    "combat": { "route": "rollBonus", "damageMultiplier": 1.0, "rollBonus": 1, "tags": [] } },
  { "id": "guard-brace",             "name": "挺身護送",   "type": "combat",        "cost": 2, "tags": ["support", "defend"],     "description": "擋在同伴身前承受此回合所有攻擊。",
    "combat": { "route": "rollBonus", "damageMultiplier": 1.0, "rollBonus": 0, "tags": ["defend"] } },
  { "id": "guard-field-patch",       "name": "野戰急救",   "type": "thinking",      "cost": 1, "tags": ["heal"],                  "description": "為隊友進行簡易包紮，恢復 4 HP（非戰鬥中）。" },
  { "id": "guard-roar",              "name": "戰吼",       "type": "communication", "cost": 1, "tags": ["intimidate"],            "description": "粗獷的吼聲，讓獸類/邪靈下一回合迴避 -1。" },

  { "id": "scout-sneak",             "name": "潛行接近",   "type": "exploration",   "cost": 1, "tags": ["sneak", "search"],       "description": "無聲接近目標，以技巧判定通過警戒線。" },
  { "id": "scout-search",            "name": "地毯搜索",   "type": "exploration",   "cost": 1, "tags": ["search", "perception"],  "description": "翻遍當前地塊一切可搜索處。" },
  { "id": "scout-track",             "name": "追蹤足跡",   "type": "exploration",   "cost": 1, "tags": ["perception"],            "description": "從泥濘、灰塵或血痕中讀出前人的動向。" },
  { "id": "scout-pick-lock",         "name": "開鎖",       "type": "exploration",   "cost": 1, "tags": ["search"],                "description": "以技巧判定打開上鎖的門或抽屜。" },
  { "id": "scout-disarm-trap",       "name": "拆除陷阱",   "type": "exploration",   "cost": 1, "tags": ["search"],                "description": "發現並解除陷阱，失敗則觸發陷阱。" },
  { "id": "scout-ambush",            "name": "偷襲",       "type": "combat",        "cost": 1, "tags": ["attack", "sneak"],       "description": "自背後發動攻擊，命中 +2。",
    "combat": { "route": "rollBonus", "damageMultiplier": 1.0, "rollBonus": 2, "tags": [] } },
  { "id": "scout-evade",             "name": "閃身迴避",   "type": "combat",        "cost": 1, "tags": ["dodge", "defend"],       "description": "下次被攻擊時額外進行一次迴避判定。",
    "combat": { "route": "rollBonus", "damageMultiplier": 1.0, "rollBonus": 0, "tags": ["reflect"] } },
  { "id": "scout-signal",            "name": "手勢信號",   "type": "communication", "cost": 0, "tags": ["support"],               "description": "無聲向同伴傳遞訊息，隊友下次判定 +1。" },
  { "id": "scout-observe",           "name": "快速觀察",   "type": "thinking",      "cost": 0, "tags": ["perception", "analysis"], "description": "一眼辨識房間內的威脅與可用物件。" },
  { "id": "scout-whistle",           "name": "引誘口哨",   "type": "communication", "cost": 1, "tags": ["persuade", "intimidate"], "description": "發出讓敵人注意力偏移的聲響。" },

  { "id": "occult-ward",             "name": "結界符陣",   "type": "thinking",      "cost": 2, "tags": ["ward", "ritual"],        "description": "在當前地塊布置短時間的結界，本次戰鬥所有隊友迴避 +1。" },
  { "id": "occult-banish",           "name": "驅魔咒語",   "type": "combat",        "cost": 2, "tags": ["attack", "ritual", "ward"], "description": "對邪靈類目標造成額外傷害，戰鬥判定。",
    "combat": { "route": "damageMultiplier", "damageMultiplier": 1.3, "rollBonus": 0, "tags": ["ritual"] } },
  { "id": "occult-commune",          "name": "冥通交流",   "type": "communication", "cost": 1, "tags": ["persuade", "ritual"],    "description": "嘗試與非人存在溝通，對 NPC 態度影響加倍。" },
  { "id": "occult-reveal",           "name": "真相揭示",   "type": "thinking",      "cost": 1, "tags": ["analysis", "lore"],      "description": "識破幻象或謊言，以智識判定。" },
  { "id": "occult-protection",       "name": "護身祝禱",   "type": "thinking",      "cost": 1, "tags": ["heal", "support"],       "description": "為同伴祈禱，本回合受傷減 2 且恢復 2 HP。" },
  { "id": "occult-chant",            "name": "低聲吟誦",   "type": "communication", "cost": 1, "tags": ["support", "ritual"],     "description": "吟誦古老祈禱詞以安定人心，隊伍獲得 +1 判定。" },
  { "id": "occult-curse-break",      "name": "解咒之言",   "type": "thinking",      "cost": 2, "tags": ["heal", "ward"],          "description": "解除當前事件施加於隊友的負面旗標。" },
  { "id": "occult-inspire",          "name": "啟示語",     "type": "communication", "cost": 1, "tags": ["persuade", "support"],   "description": "激勵沉入絕望的同伴，移除『侵蝕』類旗標。" },
  { "id": "occult-third-eye",        "name": "窺見之眼",   "type": "exploration",   "cost": 2, "tags": ["perception", "lore"],    "description": "看見常人看不見之物，揭露當前地塊的隱藏資源與旗標。" },
  { "id": "occult-shield",           "name": "祈願盾",     "type": "combat",        "cost": 2, "tags": ["defend", "ward"],        "description": "以信仰之力抵擋一次致命攻擊。",
    "combat": { "route": "rollBonus", "damageMultiplier": 1.0, "rollBonus": 0, "tags": ["reflect"] } }
]
